"","Link","Anchor Text","grp"
"95","http://www.zora.uzh.ch/136936/1/Grant_et_al-2017-Frontiers_in_Ecology_and_the_Environment.pdf","using decision analysis to support proactive management of ...","A_An_grey"
"96","http://conservancy.umn.edu/handle/11299/183571","breeding bird response to partially harvested riparian management zones","A_An_grey"
"97","https://www.ncbi.nlm.nih.gov/pmc/articles/PMC4552204/","integrating values and ethics into wildlife policy and management ...","A_An_grey"
"98","http://digitalcommons.unl.edu/cgi/viewcontent.cgi?article=1460&context=icwdm_usdanwrc","understanding avian vision: the key to using light in bird ...","A_An_grey"
"99","https://www.ncbi.nlm.nih.gov/pmc/articles/PMC4262077/","meta-analysis of attitudes toward damage-causing mammalian ...","A_An_grey"
"100","http://digitalcommons.unl.edu/cgi/viewcontent.cgi?article=1191&context=ncfwrustaff","breeding bird response to partially harvested riparian management ...","A_An_grey"
"101","https://www.ncbi.nlm.nih.gov/pmc/articles/PMC3098159/","mitigating amphibian disease: strategies to maintain wild ...","A_An_grey"
"102","http://lib.dr.iastate.edu/rtd/335/","""the anti-hunting movement--the people involved and their attitudes","A_An_grey"
"103","https://espace.library.uq.edu.au/view/UQ:167340/UQ167340_postprint.pdf","1 tourists' support for conservation messages and sustainable ...","A_An_grey"
"104","http://researchcommons.waikato.ac.nz/handle/10289/2262","utilising the human dimensions of wildlife management approach to ...","A_An_grey"
"105","http://uir.unisa.ac.za/handle/10500/23274?show=full","perception of local community participation in wildlife and tourism ...","A_An_grey"
"106","https://drum.lib.umd.edu/bitstream/handle/1903/10920/Blank_umd_0117E_11581.pdf;sequence=1","bird community response to conservation reserve ...","A_An_grey"
"107","https://repository.si.edu/bitstream/handle/10088/32020/Zoo%20View%20March%202017%20FINAL%20Anurans.pdf?sequence=1&isAllowed=y","history of captive management and conservation amphibian programs mostly in zoos and aquariums. part i<U+0097>anurans","A_An_grey"
"108","http://eprints.utas.edu.au/13319/","the response of burrow-nesting petrels and other vulnerable bird species to vertebrate pest management and climate change on sub-antarctic macquarie island","A_An_grey"
"109","https://www.ncbi.nlm.nih.gov/pmc/articles/PMC3666382/","neurotransmitter-mediated control of neurogenesis in the adult ...","A_An_grey"
"110","http://digitalcommons.unl.edu/cgi/viewcontent.cgi?article=1015&context=ewdcc5","interactions between people and wildlife in urbanizing landscapes","A_An_grey"
"111","http://digitalcommons.usu.edu/hwi/aimsandscope.html","human<U+0096>wildlife interactions (hwi) serves the professional needs of the wildlife biologist and manager","A_An_grey"
"112","Proquest","food specificity in interspecies competition","A_An_grey"
"113","Proquest","emotion and cognition in political information-processing","A_An_grey"
"114","Proquest","response of american kestrels and gray-tailed voles to vegetation height and supplemental perches","A_An_grey"
"115","Proquest","top carnivores in the suburbs? ecological and conservation issues raised by colonization of northeastern north america by coyotes","A_An_grey"
"116","Proquest","views of old forestry and new among reference groups in the pacific northwest","A_An_grey"
"117","Proquest","predation of wildlife by domestic cats felis catus in great britain","A_An_grey"
"118","Proquest","the evolutionary origin of the mammalian isocortex: towards an integrated developmental and functional approach","A_An_grey"
"119","Proquest","conserved functional organization of the amniote telencephalic pallium","A_An_grey"
"120","Proquest","prey preference and diet of neonate eastern massasaugas (sistrurus c. catenatus)","A_An_grey"
"121","Proquest","the influence of persuasive arguments on public attitudes toward a proposed wolf restoration in the southern rockies","A_An_grey"
"122","https://www.buglife.org.uk/sites/default/files/When%20is%20Brownfield%20land%20of%20high%20environmental%20value%20June%2015.pdf","open mosaic habitats high value guidance: when is brownfield ...","A_An_grey"
"123","http://suehyland.co.uk/ond/primitive-reflexes/","primitive reflexes | optimising neurological development","A_An_grey"
"124","http://wildpro.twycrosszoo.org/List_Vols/Wildpro_Gen_Cont.htm","wildpro contents - twycross zoo","A_An_grey"
"125","http://digitalcommons.unl.edu/cgi/viewcontent.cgi?article=1127&context=icwdm_usdanwrc","wildlife hazard management at airports: a manual for airport ...","A_An_grey"
"126","http://www.cieem.net/","cieem - institute of ecology and environmental management","A_An_grey"
"127","http://www.georgewright.org/0755tessema.pdf","community attitudes towards wildlife conservation in ethiopia","A_An_grey"
"128","https://www.gov.uk/government/organisations/natural-england","natural england - official site","A_An_grey"
"129","http://www.umass.edu/hd/resources/KennedyValues.pdf","managing natural resources as social value (1)","A_An_grey"
