"","Link","Anchor Text","grp"
"1","https://en.wikipedia.org/wiki/Wildlife_management","wildlife management - wikipedia","A_T_grey"
"2","https://wildlifemanagement.institute/","wildlife management institute","A_T_grey"
"3","https://www.nbcenvironment.co.uk/bird-control-services/bird-deterrents/falconry-response/","falconry bird control - nbc environment","A_T_grey"
"4","http://www.hillcountryalliance.org/wp-content/uploads/2014/06/wildlife_tax_valuation_from_extension.pdf","wildlife management and property tax valuation in texas ...","A_T_grey"
"5","http://www.contegoresponse.com/","pest control | bird control | contego response","A_T_grey"
"6","http://www.vtfishandwildlife.com/common/pages/DisplayFile.aspx?itemId=111592","public opinion on wildlife species management in vermont","A_T_grey"
"7","https://tpwd.texas.gov/publications/pwdpubs/media/pwd_bk_w7000_0788.pdf","wildlife management activities and practices","A_T_grey"
"8","http://www.nature.com/scitable/knowledge/library/intrinsic-value-ecology-and-conservation-25815400","intrinsic value","A_T_grey"
"9","https://hdru.dnr.cornell.edu/publications","publications | human dimensions research unit","A_T_grey"
"10","https://gov.nu.ca/environment/information/wildlife-management","wildlife management | government of nunavut","A_T_grey"
"11","http://www.wildlife.ca.gov/grants","grant opportunities","A_T_grey"
"12","http://www.sawma.co.za/","sawma - the southern african wildlife management ...","A_T_grey"
"13","https://jhupbooks.press.jhu.edu/content/wildlife-management-and-conservation","wildlife management and conservation - books","A_T_grey"
"14","http://www.wildlifetrusts.org/","the wildlife trusts","A_T_grey"
"15","http://www.esf.edu/efb/fishwild/","fish and wildlife biology & management","A_T_grey"
"16","https://www.cabi.org/isc/abstract/20133413292","exploring public perception of non-native species from a visions of nature perspective.","A_T_grey"
"17","https://www.cabi.org/isc/abstract/20123200919","factor influencing public preference for raccoon eradication plan in kanagawa, japan.","A_T_grey"
"18","https://www.cabi.org/isc/abstract/20173271643","assessing landowners' attitudes toward wild hogs and support for control options.","A_T_grey"
"19","https://www.cabi.org/isc/abstract/20153029503","a comparison of attitudes towards introduced wildlife in new zealand in 1994 and 2012.","A_T_grey"
"20","https://www.cabi.org/isc/abstract/20113061984","an evaluation of feral cat management options using a decision analysis network.","A_T_grey"
"21","https://www.cabi.org/isc/abstract/20133100463","understanding the threats posed by non-native species: public vs. conservation managers.","A_T_grey"
"22","https://www.cabi.org/isc/abstract/20123018925","plans to eradicate invasive mammals on an island inhabited by humans and domestic animals (corvo, azores, portugal).","A_T_grey"
"23","https://www.cabi.org/isc/abstract/20133161485","what determines the acceptability of wildlife control methods? a case of feral pig management in the wet tropics world heritage area, australia.","A_T_grey"
"24","https://www.cabi.org/isc/abstract/20123347481","factors influencing individual management preferences for facilitating adaptation to climate change within the national wildlife refuge system.","A_T_grey"
"25","https://www.cabi.org/isc/abstract/20153205492","effect of travel distance, home range, and bait on the management of small indian mongooses, <i xmlns=""http://www.w3.org/1999/xhtml herpestes auropunctatus</i>.","A_T_grey"
"26","https://www.cabi.org/isc/abstract/20133143963","invasion status of asiatic red-bellied squirrels in argentina.","A_T_grey"
"27","https://www.cabi.org/isc/abstract/20163028599","literature review and meta-analysis of vegetation responses to goat and european rabbit eradications on islands.","A_T_grey"
"28","https://www.cabi.org/isc/abstract/20123344701","private forest owners and invasive plants: risk perception and management.","A_T_grey"
"29","http://www.tandfonline.com/doi/abs/10.1080/10871209.2016.1116029","pet ownership - attitude towards pets and support for wildlife","A_T_grey"
"30","https://link.springer.com/article/10.1007/s10980-016-0463-x","bird response to future climate and forest management focused on ...","A_T_grey"
"31","http://www.earthisland.org/journal/index.php/eij/article/hunters_value_wildlife/","hunters value wildlife | earth island journal | earth island institute","A_T_grey"
"32","https://link.springer.com/chapter/10.1007/978-94-011-2868-1_23","values, problems and methodologies in managing overabundant wildlife populations","A_T_grey"
"33","http://www.vet-wildlifemanagement.org.uk/index.php?option=com_content&task=view&id=30&Itemid=32","veterinary association for wildlife management - a veterinary opinion ...","A_T_grey"
"34","https://www.nbcenvironment.co.uk/","nbc environment | bird  ecology & pest control services","A_T_grey"
"35","http://www.fao.org/forestry/wildlife-partnership/en/","collaborative partnership on sustainable wildlife management","A_T_grey"
"36","https://www.allaboutbirds.org/analysis-the-economic-value-of-birds/","analysis: the economic value of birds | all about birds","A_T_grey"
"37","https://www.dfg.ca.gov/ospr/","office of spill prevention and response","A_T_grey"
"38","http://www.bioone.org/doi/pdf/10.3375/043.034.0103","vegetative and bird community response to management ... - bioone","A_T_grey"
"39","http://www.uvm.edu/rsenr/wfb175/Manfredo%20Teel%20%26%20Bright%202003.pdf","why are public values toward wildlife changing?","A_T_grey"
"40","http://www.oiledwildlife.eu/response/response-options/management-affected-live-animals","management of affected live animals | oiledwildlife.eu","A_T_grey"
"41","https://source.colostate.edu/americans-tend-to-think-about-wildlife-like-their-ancestors-did/","americans tend to think about wildlife like their ancestors did ...","A_T_grey"
"42","http://myfwc.com/contact/nuisance-wildlife/","fwc - nuisance wildlife","A_T_grey"
"43","http://articles.extension.org/wildlife_damage_management","wildlife damage management - extension","A_T_grey"
"44","https://www.forestry.gov.uk/pdf/FCRP020.pdf/$file/FCRP020.pdf","recreational use of forests and disturbance of wildlife - forestry ...","A_T_grey"
"45","https://www.lantra.co.uk/careers/game-and-wildlife-management","game and wildlife management | lantra","A_T_grey"
"46","http://sciencenordic.com/opinion-increasing-border-security-fences-are-lethal-problem-wildlife","opinion: increasing border security fences are a lethal problem for ...","A_T_grey"
"47","https://www.cdc.gov/flu/avianflu/what-cdc-does.htm","what cdc does about bird flu - centers for disease control and ...","A_T_grey"
"48","http://rspb.royalsocietypublishing.org/content/280/1750/20122131","bird traits and response to land-use | proceedings of the royal society ...","A_T_grey"
"49","http://search.ndltd.org/show.php?id=oai%3Aunion.ndltd.org%3Anusl.cz%2Foai%3Ainvenio.nusl.cz%3A320513&back=http%3A%2F%2Fsearch.ndltd.org%2Fsearch.php%3Fq%3D%2528manage%252A%2BOR%2Bcontrol%252A%2BOR%2Bcull%252A%2BOR%2Beradicat%252A%2BOR%2Bexterminat%252A%2529%2BAND%2B%2528attitude%252A%2BOR%2Bvalue%252A%2BOR%2Bperception%252A%2BOR%2Bresponse%252A%2BOR%2Breaction%252A%2BOR%2Bopinion%252A%2BOR%2Baccept%252A%2BOR%2Bbelief%252A%2BOR%2Bpreference%252A%2529%2BAND%2B%2528mammal%2BOR%2Bbird%2BOR%2Breptile%2BOR%2Bamphibian%2BOR%2Bvertebrate%2BOR%2Bwildlife%2529%26start%3D10","mapování a analýza volne žijících živocichu v cr mapping and analysis of illegal poisoning of wildlife in the czech republic","A_T_grey"
"50","http://search.ndltd.org/show.php?id=oai%3Aunion.ndltd.org%3AADTP%2F220740&back=http%3A%2F%2Fsearch.ndltd.org%2Fsearch.php%3Fq%3D%2528manage%2A%2BOR%2Bcontrol%2A%2BOR%2Bcull%2A%2BOR%2Beradicat%2A%2BOR%2Bexterminat%2A%2529%2BAND%2B%2528attitude%2A%2BOR%2Bvalue%2A%2BOR%2Bperception%2A%2BOR%2Bresponse%2A%2BOR%2Breaction%2A%2BOR%2Bopinion%2A%2BOR%2Baccept%2A%2BOR%2Bbelief%2A%2BOR%2Bpreference%2A%2529%2BAND%2B%2528mammal%2BOR%2Bbird%2BOR%2Breptile%2BOR%2Bamphibian%2BOR%2Bvertebrate%2BOR%2Bwildlife%2529","the first reintroduction of the western barred bandicoot (perameles bougainville) to mainland australia.","A_T_grey"
"51","http://search.ndltd.org/show.php?id=oai%3Aunion.ndltd.org%3Abl.uk%2Foai%3Aethos.bl.uk%3A571664&back=http%3A%2F%2Fsearch.ndltd.org%2Fsearch.php%3Fq%3D%2528manage%2A%2BOR%2Bcontrol%2A%2BOR%2Bcull%2A%2BOR%2Beradicat%2A%2BOR%2Bexterminat%2A%2529%2BAND%2B%2528attitude%2A%2BOR%2Bvalue%2A%2BOR%2Bperception%2A%2BOR%2Bresponse%2A%2BOR%2Breaction%2A%2BOR%2Bopinion%2A%2BOR%2Baccept%2A%2BOR%2Bbelief%2A%2BOR%2Bpreference%2A%2529%2BAND%2B%2528mammal%2BOR%2Bbird%2BOR%2Breptile%2BOR%2Bamphibian%2BOR%2Bvertebrate%2BOR%2Bwildlife%2529","amphibian diversity conservation in a changing world : a view from mexico","A_T_grey"
"52","http://search.ndltd.org/show.php?id=oai%3Aunion.ndltd.org%3AMSSTATE%2Foai%3Alibrary.msstate.edu%3Aetd-09122014-131018&back=http%3A%2F%2Fsearch.ndltd.org%2Fsearch.php%3Fq%3D%2528manage%2A%2BOR%2Bcontrol%2A%2BOR%2Bcull%2A%2BOR%2Beradicat%2A%2BOR%2Bexterminat%2A%2529%2BAND%2B%2528attitude%2A%2BOR%2Bvalue%2A%2BOR%2Bperception%2A%2BOR%2Bresponse%2A%2BOR%2Breaction%2A%2BOR%2Bopinion%2A%2BOR%2Baccept%2A%2BOR%2Bbelief%2A%2BOR%2Bpreference%2A%2529%2BAND%2B%2528mammal%2BOR%2Bbird%2BOR%2Breptile%2BOR%2Bamphibian%2BOR%2Bvertebrate%2BOR%2Bwildlife%2529","effects of intercropping switchgrass in loblolly pine plantations on bird communities","A_T_grey"
"53","http://search.ndltd.org/show.php?id=oai%3Aunion.ndltd.org%3AUPSALLA1%2Foai%3ADiVA.org%3Antnu-15935&back=http%3A%2F%2Fsearch.ndltd.org%2Fsearch.php%3Fq%3D%2528manage%252A%2BOR%2Bcontrol%252A%2BOR%2Bcull%252A%2BOR%2Beradicat%252A%2BOR%2Bexterminat%252A%2529%2BAND%2B%2528attitude%252A%2BOR%2Bvalue%252A%2BOR%2Bperception%252A%2BOR%2Bresponse%252A%2BOR%2Breaction%252A%2BOR%2Bopinion%252A%2BOR%2Baccept%252A%2BOR%2Bbelief%252A%2BOR%2Bpreference%252A%2529%2BAND%2B%2528mammal%2BOR%2Bbird%2BOR%2Breptile%2BOR%2Bamphibian%2BOR%2Bvertebrate%2BOR%2Bwildlife%2529%26start%3D20","effects of native and introduced cervids on small mammals and birds","A_T_grey"
"54","http://search.ndltd.org/show.php?id=oai%3Aunion.ndltd.org%3ALACETR%2Foai%3Acollectionscanada.gc.ca%3AMWU.1993%2F22241&back=http%3A%2F%2Fsearch.ndltd.org%2Fsearch.php%3Fq%3D%2528manage%252A%2BOR%2Bcontrol%252A%2BOR%2Bcull%252A%2BOR%2Beradicat%252A%2BOR%2Bexterminat%252A%2529%2BAND%2B%2528attitude%252A%2BOR%2Bvalue%252A%2BOR%2Bperception%252A%2BOR%2Bresponse%252A%2BOR%2Breaction%252A%2BOR%2Bopinion%252A%2BOR%2Baccept%252A%2BOR%2Bbelief%252A%2BOR%2Bpreference%252A%2529%2BAND%2B%2528mammal%2BOR%2Bbird%2BOR%2Breptile%2BOR%2Bamphibian%2BOR%2Bvertebrate%2BOR%2Bwildlife%2529%26start%3D30","impact of fire in the taiga of southeastern manitoba on wildlife  and value to resource users","A_T_grey"
"55","http://search.ndltd.org/show.php?id=oai%3Aunion.ndltd.org%3AMANITOBA%2Foai%3Amspace.lib.umanitoba.ca%3A1993%2F22241&back=http%3A%2F%2Fsearch.ndltd.org%2Fsearch.php%3Fq%3D%2528manage%252A%2BOR%2Bcontrol%252A%2BOR%2Bcull%252A%2BOR%2Beradicat%252A%2BOR%2Bexterminat%252A%2529%2BAND%2B%2528attitude%252A%2BOR%2Bvalue%252A%2BOR%2Bperception%252A%2BOR%2Bresponse%252A%2BOR%2Breaction%252A%2BOR%2Bopinion%252A%2BOR%2Baccept%252A%2BOR%2Bbelief%252A%2BOR%2Bpreference%252A%2529%2BAND%2B%2528mammal%2BOR%2Bbird%2BOR%2Breptile%2BOR%2Bamphibian%2BOR%2Bvertebrate%2BOR%2Bwildlife%2529%26start%3D30","impact of fire in the taiga of southeastern manitoba on wildlife vegetation","A_T_grey"
"56","http://search.ndltd.org/show.php?id=oai%3Aunion.ndltd.org%3Anetd.ac.za%2Foai%3Aunion.ndltd.org%3Aufs%2Foai%3Aetd.uovs.ac.za%3Aetd-08192014-130619&back=http%3A%2F%2Fsearch.ndltd.org%2Fsearch.php%3Fq%3D%2528manage%252A%2BOR%2Bcontrol%252A%2BOR%2Bcull%252A%2BOR%2Beradicat%252A%2BOR%2Bexterminat%252A%2529%2BAND%2B%2528attitude%252A%2BOR%2Bvalue%252A%2BOR%2Bperception%252A%2BOR%2Bresponse%252A%2BOR%2Breaction%252A%2BOR%2Bopinion%252A%2BOR%2Baccept%252A%2BOR%2Bbelief%252A%2BOR%2Bpreference%252A%2529%2BAND%2B%2528mammal%2BOR%2Bbird%2BOR%2Breptile%2BOR%2Bamphibian%2BOR%2Bvertebrate%2BOR%2Bwildlife%2529%26start%3D30","the use of ecosystem parameters in predicting the risk of aircraft-wildlife collisions at namibian airports","A_T_grey"
"57","http://search.ndltd.org/show.php?id=oai%3Aunion.ndltd.org%3ALSU%2Foai%3Aetd.lsu.edu%3Aetd-0407103-142502&back=http%3A%2F%2Fsearch.ndltd.org%2Fsearch.php%3Fq%3D%2528manage%252A%2BOR%2Bcontrol%252A%2BOR%2Bcull%252A%2BOR%2Beradicat%252A%2BOR%2Bexterminat%252A%2529%2BAND%2B%2528attitude%252A%2BOR%2Bvalue%252A%2BOR%2Bperception%252A%2BOR%2Bresponse%252A%2BOR%2Breaction%252A%2BOR%2Bopinion%252A%2BOR%2Baccept%252A%2BOR%2Bbelief%252A%2BOR%2Bpreference%252A%2529%2BAND%2B%2528mammal%2BOR%2Bbird%2BOR%2Breptile%2BOR%2Bamphibian%2BOR%2Bvertebrate%2BOR%2Bwildlife%2529%26start%3D40","experimental predator removal: a response in small mammal communities and relations to duck nest success","A_T_grey"
"58","http://search.ndltd.org/show.php?id=oai%3Aunion.ndltd.org%3ATDX_UAB%2Foai%3Awww.tdx.cat%3A10803%2F117437&back=http%3A%2F%2Fsearch.ndltd.org%2Fsearch.php%3Fq%3D%2528manage%252A%2BOR%2Bcontrol%252A%2BOR%2Bcull%252A%2BOR%2Beradicat%252A%2BOR%2Bexterminat%252A%2529%2BAND%2B%2528attitude%252A%2BOR%2Bvalue%252A%2BOR%2Bperception%252A%2BOR%2Bresponse%252A%2BOR%2Breaction%252A%2BOR%2Bopinion%252A%2BOR%2Baccept%252A%2BOR%2Bbelief%252A%2BOR%2Bpreference%252A%2529%2BAND%2B%2528mammal%2BOR%2Bbird%2BOR%2Breptile%2BOR%2Bamphibian%2BOR%2Bvertebrate%2BOR%2Bwildlife%2529%26start%3D40","the role of acculturation in indigenous peoples’ hunting patterns and wildlife availability. the case of the tsimane’ in the bolivian amazon","A_T_grey"
"59","http://search.ndltd.org/show.php?id=oai%3Aunion.ndltd.org%3AMSSTATE%2Foai%3Alibrary.msstate.edu%3Aetd-03032016-113746&back=http%3A%2F%2Fsearch.ndltd.org%2Fsearch.php%3Fq%3D%2528manage%252A%2BOR%2Bcontrol%252A%2BOR%2Bcull%252A%2BOR%2Beradicat%252A%2BOR%2Bexterminat%252A%2529%2BAND%2B%2528attitude%252A%2BOR%2Bvalue%252A%2BOR%2Bperception%252A%2BOR%2Bresponse%252A%2BOR%2Breaction%252A%2BOR%2Bopinion%252A%2BOR%2Baccept%252A%2BOR%2Bbelief%252A%2BOR%2Bpreference%252A%2529%2BAND%2B%2528mammal%2BOR%2Bbird%2BOR%2Breptile%2BOR%2Bamphibian%2BOR%2Bvertebrate%2BOR%2Bwildlife%2529%26start%3D50","assessment of early successional arthropod and breeding bird response to intercropping switchgrass within an intensively managed loblolly pine forest","A_T_grey"
"60","http://search.ndltd.org/show.php?id=oai%3Aunion.ndltd.org%3AADTP%2F215266&back=http%3A%2F%2Fsearch.ndltd.org%2Fsearch.php%3Fq%3D%2528manage%252A%2BOR%2Bcontrol%252A%2BOR%2Bcull%252A%2BOR%2Beradicat%252A%2BOR%2Bexterminat%252A%2529%2BAND%2B%2528attitude%252A%2BOR%2Bvalue%252A%2BOR%2Bperception%252A%2BOR%2Bresponse%252A%2BOR%2Breaction%252A%2BOR%2Bopinion%252A%2BOR%2Baccept%252A%2BOR%2Bbelief%252A%2BOR%2Bpreference%252A%2529%2BAND%2B%2528mammal%2BOR%2Bbird%2BOR%2Breptile%2BOR%2Bamphibian%2BOR%2Bvertebrate%2BOR%2Bwildlife%2529%26start%3D50","influence of ripening grape compounds on behavioural responses of birds","A_T_grey"
"61","http://search.ndltd.org/show.php?id=oai%3Aunion.ndltd.org%3APROQUEST%2Foai%3Apqdtoai.proquest.com%3A10261753&back=http%3A%2F%2Fsearch.ndltd.org%2Fsearch.php%3Fq%3D%2528manage%252A%2BOR%2Bcontrol%252A%2BOR%2Bcull%252A%2BOR%2Beradicat%252A%2BOR%2Bexterminat%252A%2529%2BAND%2B%2528attitude%252A%2BOR%2Bvalue%252A%2BOR%2Bperception%252A%2BOR%2Bresponse%252A%2BOR%2Breaction%252A%2BOR%2Bopinion%252A%2BOR%2Baccept%252A%2BOR%2Bbelief%252A%2BOR%2Bpreference%252A%2529%2BAND%2B%2528mammal%2BOR%2Bbird%2BOR%2Breptile%2BOR%2Bamphibian%2BOR%2Bvertebrate%2BOR%2Bwildlife%2529%26start%3D70","habitat use  and the impacts of wetland management on autumn migrating rails in missouri","A_T_grey"
"62","http://search.ndltd.org/show.php?id=oai%3Aunion.ndltd.org%3Aasu.edu%2Fitem%3A17884&back=http%3A%2F%2Fsearch.ndltd.org%2Fsearch.php%3Fq%3D%2528manage%252A%2BOR%2Bcontrol%252A%2BOR%2Bcull%252A%2BOR%2Beradicat%252A%2BOR%2Bexterminat%252A%2529%2BAND%2B%2528attitude%252A%2BOR%2Bvalue%252A%2BOR%2Bperception%252A%2BOR%2Bresponse%252A%2BOR%2Breaction%252A%2BOR%2Bopinion%252A%2BOR%2Baccept%252A%2BOR%2Bbelief%252A%2BOR%2Bpreference%252A%2529%2BAND%2B%2528mammal%2BOR%2Bbird%2BOR%2Breptile%2BOR%2Bamphibian%2BOR%2Bvertebrate%2BOR%2Bwildlife%2529%26start%3D70","the effects of artificial water sources on small mammal communities","A_T_grey"
"63","http://search.ndltd.org/show.php?id=oai%3Aunion.ndltd.org%3ANSYSU%2Foai%3ANSYSU%3Aetd-0117107-154949&back=http%3A%2F%2Fsearch.ndltd.org%2Fsearch.php%3Fq%3D%2528manage%252A%2BOR%2Bcontrol%252A%2BOR%2Bcull%252A%2BOR%2Beradicat%252A%2BOR%2Bexterminat%252A%2529%2BAND%2B%2528attitude%252A%2BOR%2Bvalue%252A%2BOR%2Bperception%252A%2BOR%2Bresponse%252A%2BOR%2Breaction%252A%2BOR%2Bopinion%252A%2BOR%2Baccept%252A%2BOR%2Bbelief%252A%2BOR%2Bpreference%252A%2529%2BAND%2B%2528mammal%2BOR%2Bbird%2BOR%2Breptile%2BOR%2Bamphibian%2BOR%2Bvertebrate%2BOR%2Bwildlife%2529%26start%3D60","characterizations of biomechanical properties of bones in mammals","A_T_grey"
"64","http://search.ndltd.org/show.php?id=oai%3Aunion.ndltd.org%3Acanterbury.ac.nz%2Foai%3Air.canterbury.ac.nz%3A10092%2F3329&back=http%3A%2F%2Fsearch.ndltd.org%2Fsearch.php%3Fq%3D%2528manage%252A%2BOR%2Bcontrol%252A%2BOR%2Bcull%252A%2BOR%2Beradicat%252A%2BOR%2Bexterminat%252A%2529%2BAND%2B%2528attitude%252A%2BOR%2Bvalue%252A%2BOR%2Bperception%252A%2BOR%2Bresponse%252A%2BOR%2Breaction%252A%2BOR%2Bopinion%252A%2BOR%2Baccept%252A%2BOR%2Bbelief%252A%2BOR%2Bpreference%252A%2529%2BAND%2B%2528mammal%2BOR%2Bbird%2BOR%2Breptile%2BOR%2Bamphibian%2BOR%2Bvertebrate%2BOR%2Bwildlife%2529%26start%3D60","telomere length of kakapo and other new zealand birds : assessment of methods and applications","A_T_grey"
"65","http://search.ndltd.org/show.php?id=oai%3Aunion.ndltd.org%3APROQUEST%2Foai%3Apqdtoai.proquest.com%3A10002466&back=http%3A%2F%2Fsearch.ndltd.org%2Fsearch.php%3Fq%3D%2528manage%252A%2BOR%2Bcontrol%252A%2BOR%2Bcull%252A%2BOR%2Beradicat%252A%2BOR%2Bexterminat%252A%2529%2BAND%2B%2528attitude%252A%2BOR%2Bvalue%252A%2BOR%2Bperception%252A%2BOR%2Bresponse%252A%2BOR%2Breaction%252A%2BOR%2Bopinion%252A%2BOR%2Baccept%252A%2BOR%2Bbelief%252A%2BOR%2Bpreference%252A%2529%2BAND%2B%2528mammal%2BOR%2Bbird%2BOR%2Breptile%2BOR%2Bamphibian%2BOR%2Bvertebrate%2BOR%2Bwildlife%2529%26start%3D60","population dynamics of northern cardinal and carolina wren in an urban forest fragment| safe refuge or ecological trap?","A_T_grey"
"66","http://search.ndltd.org/show.php?id=oai%3Aunion.ndltd.org%3Atheses.fr%2F2014LYO10049&back=http%3A%2F%2Fsearch.ndltd.org%2Fsearch.php%3Fq%3D%2528manage%252A%2BOR%2Bcontrol%252A%2BOR%2Bcull%252A%2BOR%2Beradicat%252A%2BOR%2Bexterminat%252A%2529%2BAND%2B%2528attitude%252A%2BOR%2Bvalue%252A%2BOR%2Bperception%252A%2BOR%2Bresponse%252A%2BOR%2Breaction%252A%2BOR%2Bopinion%252A%2BOR%2Baccept%252A%2BOR%2Bbelief%252A%2BOR%2Bpreference%252A%2529%2BAND%2B%2528mammal%2BOR%2Bbird%2BOR%2Breptile%2BOR%2Bamphibian%2BOR%2Bvertebrate%2BOR%2Bwildlife%2529%26start%3D90","caractérisation fonctionnelle de deux nouveaux gènes ciliaires pendant le développement des vertébrés functional characterization of two new ciliary genes during the development of vertebrate","A_T_grey"
"67","http://search.ndltd.org/show.php?id=oai%3Aunion.ndltd.org%3AOCLC%2Foai%3Axtcat.oclc.org%3AOCLCNo%2F298944865&back=http%3A%2F%2Fsearch.ndltd.org%2Fsearch.php%3Fq%3D%2528manage%252A%2BOR%2Bcontrol%252A%2BOR%2Bcull%252A%2BOR%2Beradicat%252A%2BOR%2Bexterminat%252A%2529%2BAND%2B%2528attitude%252A%2BOR%2Bvalue%252A%2BOR%2Bperception%252A%2BOR%2Bresponse%252A%2BOR%2Breaction%252A%2BOR%2Bopinion%252A%2BOR%2Baccept%252A%2BOR%2Bbelief%252A%2BOR%2Bpreference%252A%2529%2BAND%2B%2528mammal%2BOR%2Bbird%2BOR%2Breptile%2BOR%2Bamphibian%2BOR%2Bvertebrate%2BOR%2Bwildlife%2529%26start%3D80","salt marsh bird community responses to open marsh water management","A_T_grey"
"68","http://hdl.handle.net/10453/23484 ","impacts of invasive exotic plants on reptile and amphibianassemblages.","A_T_grey"
"69","http://hdl.handle.net/2440/69173","land-use change, tropical biodiversity, and ecosystem services - southeast asian amphibians and reptiles in focus.","A_T_grey"
"70","http://hdl.handle.net/2123/10032","the effects of wildfire on small mammals and lizards in the simpson desert, central australia .","A_T_grey"
"71","http://sun.library.msstate.edu/ETD-db/theses/available/etd-10122010-185610/","effects of prescribed fire and selective herbicide (imazapyr) on biodiversity in intensively managed pine stands of mississippi.","A_T_grey"
"72","http://arks.princeton.edu/ark:/88435/dsp012v23vw90h","effects of livestock on wildlife on shared rangelands","A_T_grey"
"73","http://pqdtopen.proquest.com/#viewpdf?dispub=3524209","using light detection and ranging (lidar) technology to assess bird-habitat relationships| a case study from the northwoods of maine","A_T_grey"
"74","http://purl.flvc.org/FAU/215288","a test of factors affecting the foraging success of scarlet ibis","A_T_grey"
"75","http://dx.doi.org/10.5353/th_b4819930","impacts of illegal trapping and plantation forestry on herpetofaunal populations.","A_T_grey"
"76","http://docs.lib.purdue.edu/open_access_theses/681","the effects of radar on avian behavior: implications for wildlife management at airports","A_T_grey"
"77","http://hdl.handle.net/10150/223320","molecular phylogeography of the american beaver (castor canadensis): implications for management and conservation .","A_T_grey"
"78","http://sun.library.msstate.edu/ETD-db/theses/available/etd-04272010-143839/","fire ant response to management of native grass field buffers","A_T_grey"
"79","http://pqdtopen.proquest.com/#viewpdf?dispub=10261753","phenology, habitat use, and the impacts of wetland management on autumn migrating rails in missouri.","A_T_grey"
"80","http://hdl.handle.net/1893/2261","pine marten diet and habitat use within a managed coniferous forest.","A_T_grey"
"81","http://ufdc.ufl.edu/UFE0041538","wildlife and habitat responses to prescribed burning, roller chopping, and grazing of florida rangeland and pasture.","A_T_grey"
"82","http://hdl.handle.net/1813/40889","skin microbial communities and host-pathogen interactions in amphibians .","A_T_grey"
"83","http://dspace.knust.edu.gh:8080/jspui/handle/123456789/6873","post-logging recovery of amphibian assemblages and habitat preferences of the endangered giant squeaker frog (arthroleptis krokosua) in ghana’s moist semi-deciduous forests.","A_T_grey"
"84","http://scholar.colorado.edu/econ_gradetds/10","causes and consequences of altered avian communities in response to anthropogenic noise.","A_T_grey"
"85","http://openprairie.sdstate.edu/etd/1196","an integrated evaluation of the conservation reserve enhancement program in south dakota.","A_T_grey"
"86","http://trace.tennessee.edu/utk_gradthes/602","oak savanna restoration and management in the mid-south.","A_T_grey"
"87","http://scholarcommons.usf.edu/etd/1652","maintaining biodiversity with a mosaic of wetlands: factors affecting amphibian species richness among small isolated wetlands in central florida.","A_T_grey"
"88","http://rave.ohiolink.edu/etdc/view?acc_num=dayton1405702826","gene expression during newt lens regeneration and cephalopod eye evolution","A_T_grey"
"89","https://naldc.nal.usda.gov/download/14920/PDF","response of seedling bird vetch (vicia cracca) to six herbicides","A_T_grey"
"90","https://www.ncbi.nlm.nih.gov/pmc/articles/PMC4876446/","quantitative evidence for the effects of multiple drivers on ...","A_T_grey"
"91","https://www.ncbi.nlm.nih.gov/pmc/articles/PMC2894960/","wildlife tracking data management: a new vision","A_T_grey"
"92","http://digitalcommons.usu.edu/cgi/viewcontent.cgi?article=1276&context=govdocs","bird damage management in wyoming","A_T_grey"
"93","https://www.ncbi.nlm.nih.gov/pmc/articles/PMC4451018/","bird biodiversity assessments in temperate forest: the value of point ...","A_T_grey"
"94","https://www.ncbi.nlm.nih.gov/pmc/articles/PMC4494361/","a framework to evaluate wildlife feeding in research wildlife","A_T_grey"
"95","https://www.ncbi.nlm.nih.gov/pmc/articles/PMC4368768/","maximizing the wildlife conservation value of road right-of-ways ...","A_T_grey"
"96","http://digitalcommons.unl.edu/cgi/viewcontent.cgi?article=1398&context=gpwdcwp","an assessment of the urban wildlife problem","A_T_grey"
"97","https://www.ncbi.nlm.nih.gov/pmc/articles/PMC2725831/","wildlife - exotic pets and emerging zoonoses","A_T_grey"
"98","https://www.ncbi.nlm.nih.gov/pmc/articles/PMC4227853/","evolutionary perspectives on wildlife disease: concepts and ...","A_T_grey"
"99","Proquest","protecting nature's diversity: mending strands in the web of life","A_T_grey"
"100","Proquest","an assessment of british farmers' and gamekeepers' experiences, attitudes and practices in relation to the european polecat mustela putorius","A_T_grey"
"101","Proquest","predation by introduced foxes on native bush rats in australia: do foxes take the doomed surplus?","A_T_grey"
"102","Proquest","exploring the preferences of wildlife recreationists for features of boreal forest management: a choice experiment approach","A_T_grey"
"103","Proquest","small-mammal responses to peat mining of southeastern canadian bogs","A_T_grey"
"104","Proquest","managing bison to restore biodiversity","A_T_grey"
"105","Proquest","complete mitochondrial dna sequence of conger myriaster (teleostei: anguilliformes): novel gene order for vertebrate mitochondrial genomes and the phylogenetic implications for anguilliform families","A_T_grey"
"106","Proquest","response of nontarget species to underground strychnine baiting for pocket gopher in southwest oregon","A_T_grey"
"107","Proquest","values, gender, and concern about potentially dangerous wildlife","A_T_grey"
"108","Proquest","response to forest floor vertebrates to riaprian hardwood conversion along the bear river, southwest washington","A_T_grey"
